{
  "id": "xirp",
  "name": "Xirp",
  "path_suffixes": [
    "/Xirp/xirp-external/hook-scripts/codex/sessionStart.cjs",
    "/Xirp/xirp-external/hook-scripts/codex/preToolUse.cjs",
    "/Xirp/xirp-external/hook-scripts/codex/stop.cjs",
    "/Xirp/xirp-external/hook-scripts/codex/permissionRequest.cjs"
  ],
  "evidence": "observed",
  "references": [
    {
      "kind": "local-observation",
      "note": "Observed Codex registrations reference Xirp/xirp-external/hook-scripts/codex/{sessionStart,preToolUse,stop,permissionRequest}.cjs. Script contents were unavailable; exact behavior is unverified."
    }
  ],
  "i18n": {
    "en": {
      "summary": "Matches a Xirp Codex integration script path for session start, tool use, stop or permission requests. Script contents were unavailable; the exact behavior has not been verified.",
      "removal": "Removing this registration stops the corresponding Xirp callback. If you no longer use Xirp, you can remove it; if still in use, check its integration settings first."
    },
    "zh": {
      "summary": "路径对应 Xirp 的 Codex 集成脚本，涉及会话开始、工具调用、停止或权限请求。未取得脚本内容，具体行为尚未核实。",
      "removal": "删除后将不再触发对应的 Xirp 回调。不再使用 Xirp 时可删除；若仍使用，请先检查其集成设置。"
    },
    "zh-TW": {
      "summary": "路徑對應 Xirp 的 Codex 整合腳本，涉及工作階段開始、工具呼叫、停止或權限請求。未取得腳本內容，具體行為尚未核實。",
      "removal": "刪除後將不再觸發對應的 Xirp 回呼。不再使用 Xirp 時可刪除；若仍使用，請先檢查其整合設定。"
    },
    "ja": {
      "summary": "セッション開始、ツール使用、停止、権限要求に対応する Xirp の Codex 連携スクリプトのパスに一致します。スクリプト本体は入手できず、具体的な動作は未確認です。",
      "removal": "削除すると対応する Xirp コールバックが実行されなくなります。Xirp を使わない場合は削除できます。引き続き使う場合は連携設定を先に確認してください。"
    }
  },
  "examples": {
    "match": [
      "'/Users/demo/Library/Application Support/Xirp/xirp-external/hook-scripts/codex/sessionStart.cjs'",
      "\"C:\\Users\\demo\\AppData\\Roaming\\Xirp\\xirp-external\\hook-scripts\\codex\\stop.cjs\""
    ],
    "no_match": [
      "node /tmp/sessionStart.cjs",
      "'/Users/demo/Library/Application Support/NotXirp/xirp-external/hook-scripts/codex/stop.cjs'",
      "node /tmp/Xirp/xirp-external/hook-scripts/codex/stop.cjs.backup"
    ]
  },
  "reviewed_at": "2026-09-26"
}
